{"artifactKind":"proof-data","compatibility":{"exactConsumers":[{"cacheNamespace":"9","imageDigests":{"experimental":"sha256:4f02ca2734649eb238d13924df299b1c82bd5546ec928c5d67bdd0ce86dd0bd1","plain":"sha256:d96a4d0f3f0f10f82698288443f2873a32fed180eb8f93c0bae83572c0a187a9"},"ledgerStaticSemver":"9.0.0","proofServerVersion":"9.0.0-rc.5","sourceCommit":"7a89f45d29792be7e09ca5eb246f1e69f0b2a179"}],"installedAlias":"bls_midnight_2p4","k":4,"kind":"srs","officialAlias":"midnight-srs-2p4","rootPotSha256":"df7a1e9fcd6d3f6e8ddd777914c40c44cd29777b769e608c0604fbfbe83121ce","srsGeneration":"midnight-trusted-setup@3ea610263b228af24840f7b00661ee22360db6d8"},"componentId":"midnight-srs-k4","destination":{"repository":"effectstream/binaries","tag":"0.3.120"},"distributionTier":"development-only","family":"midnight-srs","install":{"alias":"bls_midnight_2p4","mode":"0644"},"license":{"evidence":[{"sha256":"c71d239df91726fc519c6eb72d318ec65820627232b2f796219e87dcf35d0ab4","url":"https://github.com/midnightntwrk/midnight-trusted-setup/blob/3ea610263b228af24840f7b00661ee22360db6d8/LICENSE"}],"perBlobLicenseAvailable":false,"redistributionStatement":"The Apache-2.0 source repository publicly distributes and hash-pins these unchanged public proof objects. The object endpoint has no per-blob license file; publishing requires an explicit owner acceptance record and makes no broader legal claim.","spdx":"Apache-2.0"},"lineageManifest":{"memberDigestsRequired":true,"required":true},"naming":{"appendOnly":true,"container":"raw","correctionTemplate":"midnight-srs-noarch-2p4-{generation}.bin","outerTemplate":"bls_midnight_2p4","rawName":"bls_midnight_2p4"},"operation":"identity-mirror","platform":"noarch","releaseMutability":"mutable-warehouse","schemaVersion":"component-v1","signing":null,"source":{"commitSha":"3ea610263b228af24840f7b00661ee22360db6d8","object":{"id":"sha256:232f401fad10c7ddf8828d2aa4c85c6506c5da09795998cecaeb9f75fc8f6ada","name":"bls_midnight_2p4","officialName":"midnight-srs-2p4","sha256":"232f401fad10c7ddf8828d2aa4c85c6506c5da09795998cecaeb9f75fc8f6ada","size":3460,"sourcePath":"bls_midnight_2p4","url":"https://srs.midnight.network/bls_midnight_2p4"},"repository":"midnightntwrk/midnight-trusted-setup"},"validation":{"probes":["sha256","size","raw-name","raw-mode","proof-alias","proof-compatibility"]}}