{
  "schemaVersion": "component-v1",
  "componentId": "indexer-standalone-linux-arm64-4.4.0-rc.3",
  "artifactKind": "software",
  "family": "indexer-standalone",
  "version": "4.4.0-rc.3",
  "operation": "build",
  "source": {
    "repository": "midnightntwrk/midnight-indexer",
    "commitSha": "56561b2f5cf5c6839f678257fc69bed1a8b9ba2c",
    "treeSha": "ebc2936215c8791e8bc9e5590b07991bd01878f2",
    "tag": "v4.4.0-rc.3",
    "lockedDependencies": true,
    "toolchain": "rust-1.95.0-channel-manifest@sha256:821ff14e4c4a1cbe1e8915f35aff0a3fbbdf8d293ad48ab8f31e3b0440c581f9",
    "toolchainDigest": "821ff14e4c4a1cbe1e8915f35aff0a3fbbdf8d293ad48ab8f31e3b0440c581f9",
    "buildFlags": [
      "runner=ubuntu-24.04-arm",
      "native=true",
      "command[0]=cargo build --locked --release -p indexer-standalone --features standalone",
      "env:CARGO_HOME=${RUNNER_TEMP}/phase5-cargo-home-${os}-${arch}-build${attempt}",
      "env:CARGO_INCREMENTAL=0",
      "env:LC_ALL=C",
      "env:MIDNIGHT_INDEXER_BUILD_DATE=2026-08-24",
      "env:MIDNIGHT_INDEXER_GIT_SHA=56561b2f",
      "env:RUSTFLAGS=--remap-path-prefix=${RUNNER_HOME}=/usr/src/runner-home --remap-path-prefix=${RUNNER_TEMP}=/usr/src/runner-temp --remap-path-prefix=${CARGO_HOME}=/usr/src/cargo-home --remap-path-prefix=${SOURCE}=/usr/src/midnight-indexer -C strip=symbols -C link-arg=-Wl,--build-id=sha1",
      "env:SOURCE_DATE_EPOCH=1787533457",
      "env:TZ=UTC",
      "finalProductLinkerFlags=[]"
    ]
  },
  "destination": {"repository": "effectstream/binaries", "tag": "0.3.120"},
  "distributionTier": "development-only",
  "releaseMutability": "mutable-warehouse",
  "license": {
    "spdx": "Apache-2.0",
    "evidence": [{"url": "https://raw.githubusercontent.com/midnightntwrk/midnight-indexer/56561b2f5cf5c6839f678257fc69bed1a8b9ba2c/LICENSE", "sha256": "c71d239df91726fc519c6eb72d318ec65820627232b2f796219e87dcf35d0ab4"}],
    "redistributionStatement": "Apache-2.0 source build from the exact verified upstream tag and commit."
  },
  "naming": {
    "outerTemplate": "indexer-standalone-{os}-{arch}-v{version}.zip",
    "container": "zip",
    "appendOnly": true,
    "members": [{"path": "indexer-standalone-linux-arm64-v4.4.0-rc.3", "type": "file", "mode": "0755"}],
    "limits": {"maxCompressedBytes": 536870912, "maxExpandedBytes": 1073741824, "maxMembers": 1, "maxExpansionRatio": 20}
  },
  "install": {"mode": "0755", "pathTemplate": "bin/indexer-standalone-linux-arm64-v4.4.0-rc.3"},
  "targets": [{"os": "linux", "arch": "arm64", "tier": "desired", "runner": "ubuntu-24.04-arm", "native": true}],
  "compatibility": {"kind": "software-runtime", "runtime": "Midnight node 2.0.0-rc.4 / Ledger 9 / GraphQL API v4 / SQLite standalone"},
  "signing": {"applicability": "not-applicable", "distributionSigningState": "NOT_APPLICABLE"},
  "sbom": {"formats": ["spdx-json", "cyclonedx-json"]},
  "validation": {"probes": ["sha256", "size", "archive-safety", "member-contract", "native-architecture", "native-linkage", "version", "runtime-smoke"]}
}
