{
  "schemaVersion": "component-v1",
  "componentId": "midnight-node-toolkit-2.0.0-rc.4-linux-amd64",
  "artifactKind": "software",
  "family": "midnight-node-toolkit",
  "version": "2.0.0-rc.4",
  "operation": "repackage",
  "source": {
    "repository": "midnightntwrk/midnight-node",
    "commitSha": "651e043b61ed445bf7a5066c60c87ea7bd606073",
    "treeSha": "5c34f67538f20811d876f6463cf9aca5a3bc4fc9",
    "tag": "node-2.0.0-rc.4",
    "asset": {"id": 471563135, "name": "midnight-node-toolkit-2.0.0-rc.4-linux-amd64.tar.gz", "url": "https://github.com/midnightntwrk/midnight-node/releases/download/node-2.0.0-rc.4/midnight-node-toolkit-2.0.0-rc.4-linux-amd64.tar.gz", "size": 50581636, "sha256": "fdd9f6974c1c20928d3b9dc79c13c51bf984eb6dc4cdaf1978a1b037794402de"},
    "lockedDependencies": true,
    "toolchain": "forge-phase4-transformation-toolchain-v1@sha256:141140312f43ea071a0f6cc50bf6374f6c0e1437651089eecd65a6b9369b936e",
    "toolchainDigest": "141140312f43ea071a0f6cc50bf6374f6c0e1437651089eecd65a6b9369b936e",
    "buildFlags": ["official-binary-not-rebuilt", "single-root-executable", "zip-deflate-9", "zip-epoch-1980-01-01T00:00:00Z"]
  },
  "destination": {"repository": "effectstream/binaries", "tag": "0.3.120"},
  "distributionTier": "development-only",
  "releaseMutability": "mutable-warehouse",
  "license": {"spdx": "Apache-2.0", "evidence": [{"url": "https://raw.githubusercontent.com/midnightntwrk/midnight-node/651e043b61ed445bf7a5066c60c87ea7bd606073/LICENSE", "sha256": "c71d239df91726fc519c6eb72d318ec65820627232b2f796219e87dcf35d0ab4"}]},
  "naming": {"outerTemplate": "midnight-node-toolkit-{os}-{arch}-{version}.zip", "container": "zip", "appendOnly": true, "members": [{"path": "midnight-node-toolkit", "type": "file", "mode": "0755"}], "limits": {"maxCompressedBytes": 100663296, "maxExpandedBytes": 268435456, "maxMembers": 1, "maxExpansionRatio": 8}},
  "install": {"mode": "0755", "pathTemplate": "midnight-node-toolkit"},
  "targets": [{"os": "linux", "arch": "amd64", "tier": "required", "runner": "ubuntu-24.04", "native": true}],
  "compatibility": {"kind": "software-runtime", "runtime": "Midnight node 2.0.0 / base Ledger 7.0.3 / CompactC 0.31.0-6587676a9bb2; release identity 2.0.0-rc.4"},
  "signing": {"applicability": "not-applicable", "distributionSigningState": "NOT_APPLICABLE"},
  "sbom": {"formats": ["spdx-json", "cyclonedx-json"]},
  "validation": {"probes": ["sha256", "size", "archive-safety", "member-contract", "native-architecture", "native-linkage", "version", "help", "runtime-smoke"]}
}
