{
  "schemaVersion": "component-v1",
  "componentId": "celestia-appd-existing-coverage-fixture-6.4.10",
  "artifactKind": "software",
  "family": "celestia-appd",
  "version": "6.4.10",
  "operation": "build",
  "source": {
    "repository": "example/celestia-appd-fixture",
    "commitSha": "aaaaaaaaaaaaaaaaaaaaaaaaaaaaaaaaaaaaaaaa",
    "tag": "v6.4.10",
    "lockedDependencies": true,
    "toolchain": "docker.io/library/golang:1.24-bookworm@sha256:bbbbbbbbbbbbbbbbbbbbbbbbbbbbbbbbbbbbbbbbbbbbbbbbbbbbbbbbbbbbbbbb",
    "toolchainDigest": "bbbbbbbbbbbbbbbbbbbbbbbbbbbbbbbbbbbbbbbbbbbbbbbbbbbbbbbbbbbbbbbb",
    "buildFlags": ["-trimpath"]
  },
  "destination": {
    "repository": "effectstream/binaries",
    "tag": "0.3.120"
  },
  "distributionTier": "development-only",
  "releaseMutability": "mutable-warehouse",
  "license": {
    "spdx": "Apache-2.0",
    "evidence": [
      {
        "url": "https://example.test/celestia-appd-fixture/LICENSE",
        "sha256": "cccccccccccccccccccccccccccccccccccccccccccccccccccccccccccccccc"
      }
    ]
  },
  "naming": {
    "outerTemplate": "celestia-appd-{os}-{arch}-v{version}.tar.gz",
    "container": "tar.gz",
    "appendOnly": true,
    "members": [
      {
        "path": "celestia-appd",
        "type": "file",
        "mode": "0755"
      }
    ],
    "limits": {
      "maxCompressedBytes": 1073741824,
      "maxExpandedBytes": 2147483648,
      "maxMembers": 4,
      "maxExpansionRatio": 10
    }
  },
  "install": {
    "mode": "0755",
    "pathTemplate": "bin/celestia-appd"
  },
  "targets": [
    {
      "os": "linux",
      "arch": "amd64",
      "tier": "required",
      "runner": "ubuntu-24.04",
      "native": true
    },
    {
      "os": "macos",
      "arch": "arm64",
      "tier": "required",
      "runner": "macos-15",
      "native": true
    }
  ],
  "compatibility": {
    "kind": "software-runtime",
    "runtime": "fixture-only"
  },
  "signing": {
    "applicability": "macos",
    "distributionSigningState": "UNSIGNED_DEVELOPMENT_ONLY",
    "codeSignatureKind": "none",
    "cdHash": null,
    "authorities": [],
    "teamId": null,
    "hardenedRuntime": null,
    "strictVerification": false
  },
  "sbom": {
    "formats": ["spdx-json"]
  },
  "validation": {
    "probes": ["sha256", "archive-safety", "native-architecture", "version"],
    "commands": [["celestia-appd", "version"]]
  }
}
