{"artifactKind":"proof-data","compatibility":{"cacheNamespace":"9","exactConsumers":[{"cacheNamespace":"9","imageDigests":{"experimental":"sha256:4f02ca2734649eb238d13924df299b1c82bd5546ec928c5d67bdd0ce86dd0bd1","plain":"sha256:d96a4d0f3f0f10f82698288443f2873a32fed180eb8f93c0bae83572c0a187a9"},"ledgerStaticSemver":"9.0.0","proofServerVersion":"9.0.0-rc.5","sourceCommit":"7a89f45d29792be7e09ca5eb246f1e69f0b2a179"}],"kind":"ledger-static","ledgerStaticRevision":"manifest-sha256:0417e65cbd336943aa98c0bed2153f30e175394dd4cf7209bec13376988f4ba8","ledgerStaticSemver":"9.0.0","memberManifestSha256":"0417e65cbd336943aa98c0bed2153f30e175394dd4cf7209bec13376988f4ba8"},"componentId":"midnight-ledger-static-9.0.0","destination":{"repository":"effectstream/binaries","tag":"0.3.120"},"distributionTier":"development-only","family":"midnight-ledger-static","install":{"mode":"0644","pathTemplate":"{MIDNIGHT_PP}/{memberPath}"},"license":{"evidence":[{"sha256":"c71d239df91726fc519c6eb72d318ec65820627232b2f796219e87dcf35d0ab4","url":"https://github.com/midnightntwrk/midnight-ledger/blob/7a89f45d29792be7e09ca5eb246f1e69f0b2a179/LICENSE"}],"perBlobLicenseAvailable":false,"redistributionStatement":"The Apache-2.0 source repository publicly distributes and hash-pins these unchanged public proof objects. The object endpoint has no per-blob license file; publishing requires an explicit owner acceptance record and makes no broader legal claim.","spdx":"Apache-2.0"},"lineageManifest":{"memberDigestsRequired":true,"required":true},"naming":{"appendOnly":true,"container":"zip","correctionTemplate":"midnight-ledger-static-noarch-9.0.0-manifest-sha256-{memberManifestSha256}.zip","limits":{"maxCompressedBytes":25165824,"maxExpandedBytes":22020096,"maxExpansionRatio":100,"maxMembers":16},"members":[{"mode":"0755","path":"dust","type":"directory"},{"mode":"0755","path":"dust/9","type":"directory"},{"mode":"0644","path":"dust/9/spend.bzkir","sha256":"904181287e75b0fb596ba5fcc116c882ee5d28e3115304c93ebd913722ce5841","size":2555,"type":"file"},{"mode":"0644","path":"dust/9/spend.prover","sha256":"996602da7ca386284e656c78ea03e55bffdba29475e6a67965c50de05e13efc2","size":2175671,"type":"file"},{"mode":"0644","path":"dust/9/spend.verifier","sha256":"3f1569ebcab0655c5c145b28947c74edc4e3f5c6b276e4404b661cf0905b49d3","size":1351,"type":"file"},{"mode":"0755","path":"zswap","type":"directory"},{"mode":"0755","path":"zswap/9","type":"directory"},{"mode":"0644","path":"zswap/9/output.bzkir","sha256":"91dc8b401dd8385e8d29eaac018c70b578505f48c7952452ef319bc397fa1f1b","size":494,"type":"file"},{"mode":"0644","path":"zswap/9/output.prover","sha256":"d992b04f13c3fd432f55fb8bfe6466d87bc181f1a2acf233ec228030bbdd4ed8","size":5730182,"type":"file"},{"mode":"0644","path":"zswap/9/output.verifier","sha256":"72e8074856f2f5c504ade25a86a2b8902c64aeb9497c4c8e6b26dea842a0ab08","size":2311,"type":"file"},{"mode":"0644","path":"zswap/9/sign.bzkir","sha256":"37ea2094516e145a738126307cf92bd293f7cb524b1ccd49fa6f3225a9ec3a50","size":114,"type":"file"},{"mode":"0644","path":"zswap/9/sign.prover","sha256":"fe7268dd2bdd107f862f881ac3c5bc71a6df77ce80bfed51cf71514648e660e0","size":2814823,"type":"file"},{"mode":"0644","path":"zswap/9/sign.verifier","sha256":"e39a727caa0de167e6dd6122a9e3b758fecf48f9093ab77c0309648de8ce07e1","size":2023,"type":"file"},{"mode":"0644","path":"zswap/9/spend.bzkir","sha256":"7cb5bbcf67cb212a3336fb439a77e8f32f0aa8a56185c8e1247d6cbfc7300205","size":1294,"type":"file"},{"mode":"0644","path":"zswap/9/spend.prover","sha256":"19d234b5c68b7212ad6b0ec9334a95594748154128f3704eb576bcc843cc5c45","size":11020001,"type":"file"},{"mode":"0644","path":"zswap/9/spend.verifier","sha256":"544554effd7ae9fb9063be52a9ec2a986756301071fcd97bb4598fb45a335658","size":2311,"type":"file"}],"outerTemplate":"midnight-ledger-static-noarch-9.0.0.zip"},"operation":"assemble-data","platform":"noarch","releaseMutability":"mutable-warehouse","schemaVersion":"component-v1","signing":null,"source":{"buildFlags":["--deterministic","--member-manifest","--zip-epoch=1980-01-01T00:00:00Z"],"commitSha":"7a89f45d29792be7e09ca5eb246f1e69f0b2a179","lockedDependencies":true,"repository":"midnightntwrk/midnight-ledger","toolchain":"docker.io/library/python:3.12.11-slim-bookworm@sha256:519591d6871b7bc437060736b9f7456b8731f1499a57e22e6c285135ae657bf7","toolchainDigest":"519591d6871b7bc437060736b9f7456b8731f1499a57e22e6c285135ae657bf7"},"validation":{"probes":["sha256","size","archive-safety","member-contract","proof-compatibility","member-manifest"]}}